name	review	raiting	quality
Now You See Me 2	"Here's the thing about 2013's ""Now You See Me,"" I didn't hate it but I wasn't completely wowed by it either. Mildly entertaining is how I'd describe it. It's heist caper like Ocean's Eleven but with faster sleight of hand. So to say that ""Now You See Me"" didn't have its amusing moments, would be a lie. But this sequel however, NOW YOU SEE ME 2, is a big giant mess.In NOW YOU SEE ME 2, the four horsemen Jesse Eisenberg, Woody Harrelson, Dave Franco, Lizzy Caplan, after a year of outwitting the FBI and winning the public's adulation with""Now You See Me"" was a personal guilty pleasure of 2013, it was absolutely unpretentious and unbelievable but it knew it was so and with the help of a talented cast and a couple of good characters and story beats it turned out as a fine time at the theater. Its sequel starts out with the same unpretentious and fun vibe of the first only to slowly escalate up to what becomes one of the most lifeless and visually painful experiences of the year.As I said the movie started out really fine, in the sense that it was doing whatthe first movie was good, i love it in fact. All the tricks were kinda impossible, but at least its all make sense after they showed us how they did it and added with an interesting plot twist at the end. Now you see me 2, however, went to the next level of bull tricks and meaningless story line with ""crunchy"" jokes. It was boring and confusing. I wasted 2 hours for nothing. I used to think that the characters in the first movie were good and well tough out - they were good as a team and fun toIf you want a movie about magicians, and are not 12 years old, I'll recommend The Illusionist or The Prestige. If you like superhero movies - watch one of those. This is kind of a mix.I guess what I'm trying to say is:If you like movies that are fast paced, where they try to cram as much as possible into the movie in as little time as possible, kind of a movie directed by a hamster or something, then you'll probably like this movie.If you suspension of disbelief comes easy to you, then you'll also like it. Because there isWhile the first installation was enjoyable, the second one does not live up. The plot was bland and dull and dragging. The dialogue was dry and just downright stupid. The magic tricks were OK (and unnecessary), but there was no wow factor. No jaw-dropping revealing or mind hack or anything like that. If the first movie keeps you guessing until the final scene, then Now You See Me 2 just basically tells the whole story in a straight line. It's just plain badTo pair with the bad plot, the acting was also horrid. Lizzy Caplan was beyond tragic. There is"	6.5	0
Thor: The Dark World	"In my honest opinion the sequel ""Thor: The Dark World"" was much better and the strongest sequel in my opinion, it is a good sequel too ""Thor"". It was much better than the original for the sci-fi dark fantasy, CGI special effects, better action sequences than in the first one and it is a true sequel to the first film. I like this movie more than Iron Man 2, because it as a good decent solid bad-ass, kick-ass superhero flick. Thor saving the world. I love, love this movie more than the sequel, in my honest opinion this movie get'sThe acting was solid. The production value was superb. Everything else was really poor.The back story and character motivations are laughably sparse. Most of the characters are completely one-dimensional, with the possible exception of Loki. The plot is the most boring and typical of all action plots - some ""bad dudes who happen to be really ugly"" decide to ""destroy the world for no reason other than being evil"" and ""only our hero can save us all"", etc. Moreover, it was lazy writing - whenever an absolute miracle needed to happen, it conveniently did, every time. Of course this isThe first Thor was probably one of Marvel's more trickier movies since it centered heavily around Norse mythology. To make it work in the ""real"" world was a massive task. Integrating a billionaire playboy who doubles as a tech-powered superhero, or a scientist who turns into a green rage monster was easier to accomplish than the fantastic world of Asgard, Gods & Monsters.Credit must go to Kenneth Brannagh who found the right balance between the fantastic and ""real"" (that's a stretch anyways) world. Furthermore, Brannagh focused on the characters instead of bombastic vfx (he still provided tons of beautiful shotOccasionally in life there are those moments of unutterable fulfillment which cannot be completely explained by those symbols called words. This sequel is one such moment. I do need to see it again. In terms of pure enjoy-ability, I put it top 3 of all sequels that I have enjoyed.What I really liked...-Every single character gets a moment to shine and every single actor cast in these parts are perfect. -The comedy is perfect. It's such a fine balance overall and everything works because it's very subtle and fits in with certain circumstances. -Some very tender emotional scenes. I won'tThere are a number of reasons why I found this film to be disappointing, unlike its predecessor which I enjoyed very much.1) Underdeveloped Bad Guy Syndrome: I know almost nothing about the bad guy even after watching the film. A dark elf who wants to blow everything up. Apparently that's all we need to know and all we'll ever know about the main villain in the film.2) Pointless Main Characters: The main characters in this film offer nothing of substance or value. For example, you could have replaced Jane with any other character without affecting the film. She exists solely"	7.0	0
River Runs Red	"Its fairly uncompromising and gritty which i liked. It highlights institutional racist andNovice writer & director Wes Miller should have passed on the screenplay duties to someone more experienced. The premise of the story was good, but it was executed poorly.What was the point of even having John Cusack in the film? And why does he always have to wear the lame sad black clothes and baseball cap in every film?The character development was pretty lame, especially Taye Diggs' Asian wife that totally did not make them look like a couple and was annoying with the subtitles when she was speaking in Chinese. Their son wasn't even 1/10th Chinese, so gain, whatStilted acting, uninspiring dialogue and laughable cinematography are some of the best things about this film.I'm all for using film to highlight social issues and when done respectfully can make for truly memorable cinema. When this is rushed, under funded and poorly cast you end up with a film such as this.Sadly memorable only for it's short comings, 'River Runs Red' is at best laughable at worst unforgettable, but hey if you've nothing better to do with your evening give it a watch you may well answer the question ""what would Ed Wood be doing now if he was aThere was nothing goodNo idea how this movie got an over 7 rating,it's"	5.6	0
The Lord of the Rings: The Two Towers	Peter Jackson truly outdid himself when creating the Lord of the Rings: The Fellowship of the Ring and he fails to disappoint us in the 2nd part of the Trilogy. The Two Towers shows us that he is not a one-hit wonder, like so many directors are. I actually think that The Two Towers reaches the same level as the Fellowship of the Ring, and sometimes even surpasses it.This film is the biggest film in the trilogy. What do I mean by that? Well this film has so many things going like the amazing Battle of Helms Deep. Frodo andIt seems ridiculous to want to add my own comments to a slew of others that are already in IMDB's records, but I feel like I cannot sleep nor cease the throbbing in my chest until I release some of what I have so recently seen.Peter Jackson's The Lord of the Rings is one of the bravest projects ever attempted by a filmmaker. Mr Jackson deserves every ovation he will receive, every award, every bit of the praise and adoration that will be spoken and written.This second installment of the story is a masterpiece in every sense, forget your prejudicesFrom the beginning to the very end, the Lord of the Rings trilogy is interesting and enjoyable. The books and the movies alike grasp one's attention as if they were real. You, the reader or viewer, can sense the pain of the characters, their emotions. The trilogy is truly powerful on screen. The second movie, however, I believe has something the first and third are missing; it feels like a bridge connecting two great islands. There is something unique about it that cannot easily be described. Metaphorically, the first movie is, say, a soldier. The third movie is the pathEvery great adventure story worth telling has a solid hero - someone who puts others before themselves and uses their talents to do their best at keeping the forces of evil at bay even if it means the loss of life and limb. At its core, this movie has eight such heroes and each one lives up to the call. From Pippin and Merry, the lost hobbits who aid the Ents in battle, to Gandalf, Aragorn, Gimli and Legolas who held back the hordes at Helms Deep to Frodo and Samwise who continue to make their dangerous and arduous trekThe opening scene of The Two Towers provides an outstanding, yet very brief, taste of action, cinematography, and special effects, only to be matched (and far surpassed) in the final hour of the film. The stunning events of the third hour of The Two Towers are undoubtedly the centerpiece of the film, and while the first two hours serve finely as story development, they primarily build anticipation for the final hour, which mostly depicts the battle of Helm's Deep. More than anything else, the first two hours merely tease and torment the patient audience. It's a shame that such a	8.7	1
Pulp Fiction	"One of the early scenes in ""Pulp Fiction"" features two hit-men discussing what a Big Mac is called in other countries. Their dialogue is witty and entertaining, and it's also disarming, because it makes these two thugs seem all too normal. If you didn't know better, you might assume these were regular guys having chit-chat on their way to work. Other than the comic payoff at the end of the scene, in which they use parts of this conversation to taunt their victims, their talk has no relevance to anything in the film, or to anything else, for that matter.To put this in context, I am 34 years old and I have to say that this is the best film I have seen without doubt and I don't expect it will be beaten as far as I am concerned. Obviously times move on, and I acknowledge that due to its violence and one particularly uncomfortable scene this film is not for everyone, but I still remember watching it for the first time, and it blew me away. Anyone who watches it now has to remember that it actually changed the history of cinema. In context- it followed a decadeI can only speak for myself, but I had never seen anything as stylish, cleverly constructed, well written and electrifying as this milestone when I first saw it in 1994. What really pulled me in right from the start is what we've now come to know as a Tarantino trademark: the dialogue. When gangsters Jules and Vincent talk to each other (or all the other characters, for that matter) there is a natural flow, a sense of realism and yet something slightly over the top and very theatrical about their lines – it's a mixture that immediately grabs your attentionViewers are taken on a ride through three different stories that entertwine together around the world of Marcellus Wallace. Quentin Tarantino proves that he is the master of witty dialogue and a fast plot that doesn't allow the viewer a moment of boredom or rest. From the story of two hit-man on a job, to a fixed boxing match to a date between a hit-man and the wife of a mob boss. There was definitely a lot of care into the writing of the script, as everything no matter the order it is in, fits with the story. Many mysteriesPulp Fiction may be the single best film ever made, and quite appropriately it is by one of the most creative directors of all time, Quentin Tarantino. This movie is amazing from the beginning definition of pulp to the end credits and boasts one of the best casts ever assembled with the likes of Bruce Willis, Samuel L. Jackson, John Travolta, Uma Thurman, Harvey Keitel, Tim Roth and Christopher Walken. The dialog is surprisingly humorous for this type of film, and I think that's what has made it so successful. Wrongfully denied the many Oscars it was nominated for, Pulp"	8.9	1
Searching	"I was just utterly entertained and delighted by this film. Because it was just SO well done.It's innovative cinematography was not presented at the sacrifice of a well-crafted and compelling story. Unlike the Blair Witch Project, these filmmakers put as much time and care into their story as they did with this method of filming. They could have honestly filmed this in the traditional way and it would have still been a worthwhile movie outing. This was indeed a solid work of art.Even with so many moments absent of dialogue or even human characters to watch, the film was alwaysThis film got it right in the technology department. All real websites, technology and actual examples of how you can search the internet to find information. They had to get this right and as an avid tech enthusiastic i was pleasedFor all the people who ever tried (And failed) to make a compelling thriller about the internet, from ""Unfriended"" to ""Megan Is Missing"", I have news for you:Someone finally did it.""Searching"" is quite possibly the first film I've seen that truly treats the internet as the entity it is without any silly exaggerations, fake websites, ignorance or judgement. Instead, this film treats it as a platform to tell a compelling mystery story with an excellent performance by John Cho and a quite honestly revolutionary sense of direction at its center.""Searching"" concerns itself primarily with the character of David Kim, playedIt's the number of people sitting at the edge of theirA story told entirely through a character's laptop screen - it's an increasingly popular gimmick that's now been done enough times that it can no longer be called fresh. But, thankfully, this is best execution of the style to date. Aneesh Chaganty dazzles in his directorial debut, displaying a mastery of the medium, crafting a compelling film narrative told entirely through someone's laptop activity. The movie comes out hot with a mostly nonverbal tale of love and family that's shades of 'Up' and nearly as affecting. An emotionally warping scene like that to kick things off lets us know immediately"	7.8	0
Smallfoot	"We thoroughly enjoyed this movie. The soundtrack- especially wonderful life- is beautiful. The message is so heartwarming, and there were lots of funny moments tooI don't believe people can't see the messages in this film. The truth sets you free, tolerance, don't let others tell you what to believe in,You never know what you're going to get with non-Disney/Pixar animation. It might be an Illumination Entertainment-style effort -- lacking in substance but lots of wise cracks and kid-friendly touches (think ""Minions"" or ""Sing"") -- or a Laika-style affair, with depth and darkness to boot (""Kubo and The Two Strings""). Warner Animation Group has form, of course, with ""The Lego Movie"" combining laugh-out-loud humour for the kids with a knowing, subversive quality to keep the Mums and Dads entertained. It also produced ""Storks"", a much more pedestrian effort. Thankfully, ""Smallfoot"" belongs in the former camp. Boasting impressive CG animation courtesyCleverly inverting the point-of-view from which a tale of human and Yetis would probably be told, 'Smallfoot' tells of a clan of bigfoots living high up in the Himalayan mountains whose peaceful and orderly lives are disrupted when one of their own stumbles upon a smallfoot. It isn't just that these smallfoots have thus far been the stuff of myth; in fact, their very existence goes against the community's long-held beliefs, which are literally set in stone and worn around the neck of the high and mighty Stonekeeper (Common). So as you can probably expect, that very individual is toldThe movie was beautiful, entertaining and funny. It had a good take away message and the casting was great. There was something missing though, I can't put my finger"	6.8	0
Mad Max: Fury Road	"When I wrote this review 3 years ago I had no idea how many people hate this movie and they are preferring Mad Max 3 over this film. Claming Mad Max Beyond Thunderdome the third film is better film than this, really? Better than this? Listen folks it has no Mel Gibson so what? So what's your point? Gibson dropped out this film and he wasn't interested, it was in development for years, since in 2004 this movie was announced. George Miller did something different with this film and he got hate for it. I hate Mad Max Beyond ThunderdomeAn action essential through and through, it's plain and simple! Since the days of 'Die Hard' and 'Terminator', the action genre has turned into a repetitive, over-the-top array of films trying too hard to create entertaining sequences that instead look too cheesy due to bad composition or an overuse of CGI, of course along the way we have had some fine exceptions in the style of 'Casino Royale' and 'The Dark Knight', but certain directors *cough* Michael Bay... don't seem to be able to use their knowledge of an action sequence to its full potential and instead have constant fieryGeorge Miller returns to live-action filmmaking with one of the greatest action films ever put to screen. 'Mad Max: Fury Road' is ridiculous in all the right ways.For those who have seen the original films and loved them, you'll fall in love all over again with this film. Tom Hardy takes the reigns this time around as Max - a man of few words who has been hardened by the world in which he lives. Along with him is Charlize Theron as Imperator Furiosa - a woman who seeks redemption by helping five young '""wives"" escape from the film's antagonist.LeadingMad Max: Fury Road, starring Tom Hardy and Charlize Theron, is George Miller's attempt to reignite his long dormant Mad Max franchise...and my god does he ever. For the past decade or so, with exceptions such as John Wick, The Bourne Trilogy, and The Raid, action movies seem to be struggling to capture the excitement and enjoyment the genre once held; a tenacity that classics from the 80's and 90's had in spades. George Miller single handedly delivers our saving grace with Fury Road on the back of a spike covered oil rig with a blind zombie playing a fireMad Max Fury Road is George Miller's return to the franchise he started way back in 1979 with Mad Max. I will start by saying this movie was absolutely batsh** insane. It was filled right to the brim with continuous over the top bloody ridiculous action sequences that keep you on the edge of the seat and just amazed at what Is happening on screen. Now this film doesn't have much of a plot at all but seriously you're not going into this film for an intense plot, this is a film that almost didn't even need one at all."	8.1	1
Venom	We just came out of the theatre and I can honestly say. I liked it! It was funny and it paid great homageI don't know what'sFirst of all Iv just watched the movie a couple of hours ago and Iv just been reading a few reviews and I must have been watching a different movie to them cause I absolulty loved Venom!I love the relationship between Eddie and Venom, they proper cracked me up with some of the things they said and the whole room was laughing at loads of moments throughout the movie. Coming out of this movie makes me want to have a symbiote latch onto me if it's anything like the film. I loved the movie from end to finish, it wasDon't listen to the critics whom are desperately trying to remain relevant in a time where the opinion of the audience truly matters.The movie is geniunely good. What it isn't is fantastic however.-buildup. The intro of the movie was fine. Nothing spectacular but certainly progressed the story into the right direction. Though it did linger on for a tad bit too long.-The plot while amusing, is definitely lacking and drops the ball at least at a certain point, which i cant really dive into here due to spoilers. This certainly is the biggest problem with the movie. -CGI. Not greatHad a test screening tonight in cinema I work at, and couldn't wait to watch my all-time favorite Marvel (anti) hero on big screen. Tom Hardy is great as always, that guy really can act. Can't think of anyone else who would be a better choice for the role but him. Introduction was really long, but I was not bored for a second. When Venom comes in his true form - the party starts! Wish few action scenes were less like Michael Bay's style (hardly see anything) but the inner child in me was really happy for Venom's maniacal kicking	7.0	0
Upgrade	"I went into this movie having no clue what it was about and wasn't expecting much, but I loved it. There are innumerable movies with huge budgets that simply fall flat, and Upgrade, with a Budget of around $5,000,000, which doesn't cover the cost of catering on some of these huge budgeted flops, honestly looked like it cost a lot more than it actually did.  Intelligent script, good action, very few unnecessary scenes, and though I thought it was sure to let me down, a very good ending. And although I have seen much of Logan Marshall-Green's work andThe commericals made Upgrade look like merely a sci-fi action/revenge flick, which it kind of is, but there was more to it than I expected. I'm glad I saw this.The film contains tight directing, acting, and music as well as some creative kills. I was very impressed with some of the futuristic decor in this. The plot is fluid and competently handled. Though some parts are predictable, the movie really did play against expectations in one part I won't give away, and overall the film does a good job of surprising.The film does get darker than I expected, but IThis has seriously become my favorite AI movie to date. I can't believe it was low budget because it's impossible to tell apart from the unknown actors who all do an excellent job. I will do my best to replace its lack of marketing with recommeding it to everyone. I was expecting something entertaining and instead got an amazing plot with a mind-blowing ending. If you enjoy this genre, you can't let this one pass you by. What everyone says is true, it's like a long, perfectly executed Black Mirror episode. I rated it 10 stars for the simple reasonThrough and throughThis film is basically ""Robocop"" meets ""Death Wish"", with less satire than the former and more humor than the latter. And it's a B movie blast. An unrelenting pace, fantastic fight choreography that doesn't skimp on the gleeful blood and gore, and never not fun or interesting to look at. Yeah some of the one-liner dialogue as delivered by Logan Marshall-Green feels a bit forced and the plot isn't exactly clever or unique, but damn it, it all works and it makes it's own beautiful alchemy out of a bunch of borrowed parts. This is cheap genre filmmaking done right"	7.6	0
