name	review	raiting	quality
Deadpool	"I really, really liked Deadpool. And you know what? I didn't expect to. Seriously, I was never a fan of the character (in the sense that I hardly knew anything about him) and the humor as well as the violence seemed forced and overdone in the trailers. Still, I remained interested in the film, I just never expected it to actually be good - until the reviews arrived. After most critics unexpectedly showered this newest superhero movie with praise, I went in cautiously optimistic (but still fully prepared to hate the film).The first thing I noticed was how inventive theDeadpool is a damn good bad-ass action film in the MARVEL comic book section movies I have seen. The film is rated R with blood squibs, filed with explosive action, I love this film from end till end, it is one of my favorites. It has jokes and humor I was laughing, the same time I enjoyed a bloody action sequences. In the opening scene you have a bad-ass action sequences in which Deadpool jumps in too van beating thugs. On a bridge is fantastic sequence in which Deadpool has only 12 shots in his IWI Desert Eagle Mark XIXDeadpool is a triumph of artistic vision over studio interference. Little credit should be given to 20th Century Fox, as they had zero faith in the success of a Deadpool movie. To put things into perspective, Ryan Reynolds fought for this film back in 2004 when Blade: Trinity was released. Reynolds and co. went to shoot test footage that was then leaked online by Reynolds because Fox had no intentions to release it to the public. Finally, after years and years of BEGGING to the studio and the overwhelming positive responses of the test footage from the public, Fox didn'tAt first glance, Deadpool seems like a typical superhero movie due to it being made by Marvel. But once those hilarious intro credits show up, you know you are in for one of the most creative films in recent years. The first thing that is unique about this film is the characters. In typical superhero films the characters are stiff and super serious, in Deadpool the characters are filled with personality and can range from the serious Francis to the silly Deadpool giving this a parody like feel, in a good way.Also what is different is that this is a""Deadpool"" is a very fun movie. After the characterization of Deadpool I saw in ""X-Men Origins: Wolverine"", I never wanted a Deadpool movie. I got one. It didn't disappoint. But at the same time I feel it is one of the most over-praised movies of all times. I don't hate this movie at all, but at the same time, I don't like it either. The majority of it is entertaining. What works? First and foremost, the character - Deadpool. This hilarious and goofy badass merc with a mouth is something I really liked. His jokes, punchlines and fourthwall breaking humor"	8.0	1
The Nutcracker and the Four Realms	"I really enjoyed this film. A lot of the negative reviews seem to be awfully nitpicky for a family Disney movie. It's no masterpiece but I can't understand all the hate.As we can all agree, it's visually stunning. The costumes are magnificent as well as hair and makeup. The sets are stunning and surprisingly, according to some of the interviews I've watched, most of it is not CGI. They created a beautifully detailed world and it pays off.The story is not the same as the ballet, nor does it claim to be. I personally wouldn't want it to be theMackenzie Foy tries her hardest here, and I enjoyed the one scene with Misty Copeland on stage. However, dialogue and story is beyond muddled. Internal logic makes no sense. Another fairy tale is now an edgy political commentary and an ""epic war"". World feels confined and claustrophobic. A bunch of tired Disney cliches surface here, like moping about dead mothers and Chosen One Princess. They even have a twist villain, because that's so beloved.It's cynical and unpleasant. Too dull and scary for kids, too dumb for adults. If you're looking for the Nutcracker you won't find it here. Just goOkay, look, I didn't expect much from this movie, but wow... where do I start?, well I can say the movie looked okay from the trailers, so there's that and it has a fantastic cast too, so they might add some good luck to this movie, but besides that, just looks like a Alice in Wonderland spin off or something, so I went in with little expectation.... well there might be some promise for this, after the charming Christopher Robin, there might some potential to this movie, so then I saw the movie on the third of November, the dayHonestly, where to start with this beautiful travesty? Despite boasting a stellar talent and cast with the likes of Helen Mirren, Keira Knightley, and Morgan Freeman, this cinematic endeavor turns out to be an unholy and misguided collaboration, and points to everything wrong about this terrible and miscalculated adaptation.First, the tone and the quality is clearly a rip-off to the other fantasy films that preceded it, such as the 2010 version of Alice in Wonderland, The Chronicles of Narnia, and The Wizard of Oz. The script is totally cliched, muddled, confusing, and convoluted, given the fact that the screenwriter ofAt its attempt to be unique and edgy, the creators made a film that is real cheesy, at times boring, predictable, and unnecessarily dramatic in the choice of music and manner with which particular characters responded to each other.I was very disappointed because I love the"	5.6	0
Avengers: Age of Ultron	"Avengers: Age of Ultron (2015) is a MARVEL personal favorite film of mine I love MARVEL films and Avengers: Age of Ultron is a damn good sequel to Avengers. I love this film, if I would had to pick top 10 MARVEL favorite films I would put this movie in my top 10. It is a decent, solid, good, entertaining action sequel. James Spader took my heart out as Ultron. Aaron Taylor-Johnson and Elizabeth Olsen we are also good to look too who were twins in the film want it too destroy Tony Stark and the Avengers. Joss Whedon wroteSpoiler free review. Let me first start of by saying that I am not a Marvel ''fanboy'' or a DC nerd. The comic book genre of films have made it to my personal top 3 favourite genres in the last decade and the MCU has been a strong contributor to that rise. I hold the first Ironman, first Avengers and Captain America 1+2 in high regard. I did not like the direction they took with Iron Man 3 (more on this below) or Guardians of the Galaxy but Winter Soldier was a gem in terms of balancing solid action, dramabeing a huge Marvel fan, and also Josh Whedon fan I was super excited for him to come back and do another Avengers movie. The first film was pretty brilliant. But with this film, Whedon wasn't given much air to breathe, with constant Studio interference and orders of certain shots to be re- done, or scrapped if not worse. Put in.So, you thinking why is this film so bad, if you are a fan, you should love it. Well the film changes pace, very quickly and abruptly, which is a poor sign of movie making. The Characters do not actIn 2012, there came a day unlike any other day where the worlds greatest heroes were united against a common threat and THE AVENGERS blew away audiences of all ages with the first ever comic book movie crossover. In 2015, there came another day unlike any other day and this time the world is threatened by a Ultron, the cynical critical atypical child of Skynet and Megatron...... No actually he's just a wisecracking artificial intelligence with delusions of godhood and all round evil. Turning on his creators, he threatens all life on earth with his sidekicks ""illusion- woman"" and ""not-the-flash""....II have noticed a trend of negative reviews directed at the humor in the movie. Listen...humor is subjective. It's also a big part of these types of movies. When I read someone criticize the movie because the heroes are dropping one-liners during intense fighting scenes and to them, this downplays the seriousness of the situation or shows a lack of concern for safety from our heroes, I shake my head so hard I get dizzy.This is a comic book movie! It's a fantasy/fiction/whatever you want to call it! I'm not a comic book expert, but have been a big fan"	7.4	0
The Kissing Booth	"Its so cheesy and SO cringey that i kept face palming and rubbimg my oncoming headache away. Please dontSPOILER: Sure, at first glance the movie is cute and light. Elle and Noah are a classic girl and best friend's older brother deal, not unusual but not too sappy. But here's the real problem: Noah is extremely controlling and manipulative of Elle- before they're even dating. He orders her around and expects her to do as he says, tells her not to go to parties, threatens boys who want to date her, and gets into fights over her. There is one scene in particular where he fights someone over something they have said to Elle, and then he screamsAs I watched, I kept thinking that this movie had a very limited target audience. High school kids would likely relate to this, especially high school girls. Anyone older than that, would see the absurdity of everything going on and ask, ""WTF?""     The Kissing Booth is the story of two high school best friends, Lee and Shelly (Joel Courtney and Joey King). They love to dance, according to the opening narration. This comes up later in the movie in a way that's supposed to be significant and touching, but it's actually lame and eyeroll-worthy.  TheCringiestI know a lot of people hated the message but I didn't mind it at all. I'm all for it. It could have been much worst. World let's not have blinders on....things like this happen...people have anger issues....you fall for the wrong people...you make childish stupid mistakes. But to read comments about the lead female character attractiveness is the problem with the world today. I really enjoyed it and will watch it again. Although the message isn't great for the younger crowd....parents should be responsible for what they allow their kids to watch. But for a older person who enjoys"	6.2	0
Crazy Rich Asians	Al these reviewers here calling this film Romantic or Rom-Com must have a twisted sense of what romance and romantic is. This film is half comedy and half tragedy. There is no romance. A bunch of newly rich who spent their childhood riding mules are now millionaires, marrying for money, marrying for sex, cheating and philandering and this passes as romance nowadays. Well, I think not. Think Cinderella or other fairy tales and now reverse it. That is the image of these very plastic capitalist materialist greedy human replicas. How sad.What is really sad that all the people in theThe stereotypes in this movie are way over the top:Racist British man whoThis is a stereotypical film about recently rich Chinese/Singaporeans (not Asians, the title is a marketing trick) that are not self aware. They confuse money with prestige, the kind you see queuing outsideMaterialistic story and superficial acting, couldn't help rollingNot a bad movie, but you	7.2	0
The Hobbit: The Battle of the Five Armies	"Peter Jackson, with this new trilogy, which adapts a somewhat long children's fairy tale into a three-part action epic, each movie being three hours long and delving into completely irrelevant stories that are only hinted at in Tolkien's body of work, has really destroyed his reputation as the Tolkien translator. He will always live in the shadow of The Lord of the Rings, which is a sumptuous, beautiful, heartrending, thrilling masterpiece.I don't know what happened. But Jackson sacrificed tone, realism, characterization, and story when he adapted The Hobbit. It is unrecognizable as work by the same director.There are so manyWhat a difference an Extended Edition makes. For the first part we got some jolly embellishment. For The Desolation of Smaug we got bags more depth and character. For The Battle of the Five Armies, it may - I hope - be transformative. Because right now this feels like An Unfinished Journey.It's as if, after all the complaints about splitting a pamphlet of a novel into three parts, Peter Jackson is playing a joke on us: This is what you get when you ask for Middle-earth-lite. Characters we've come to love or loathe arc into nothing; others (e.g. Beorn andWell, I have to say that I'm glad that's over. The final movie was well worth the price of admission, which in my case was a free ticket to a preview screening.I found this movie to be a stretch and as the final movie in a trilogy that was getting less interesting the further you went into the series, I left feeling extremely disappointed, and glad I didn't pay for the premium experience (3D, Imax, etc).There was a little too much CG this time around, and it wasn't even all that great. Case in point two close scenes with aIf you haven't read The Hobbit and/or if you like the first two movies: I envy you of sorts... If someone had told me some years ago that I would consider walking out from a Tolkien movie opening night, I would have slapped them with a cod. Or a salmon. The Hobbit trilogy is crap.It's little more than a long list of invented battles and love stories to attract a widest possible audience, as well as loads of idiotic storyline to make the story slide into the Lord of the Rings movies as smooth as an Elven ass. I understandBefore seeing _The Battle of the Five Armies_ today, I told people, ""The first two films lacked fidelity to the book, but this one should be better."" I figured Jackson wouldn't have to add lots of extraneous invented action scenes because the final third of the book contained plenty of action.Boy, was I wrong.Unnecessary invented characters from the previous films continued to take up screen time in this one, and many new ones were added. Tolkien wouldn't recognize a bunch of grand-scale evildoers or various ""good guys"" whose relationships were supposed to tug at our hearts, though they turned my"	7.4	0
Doctor Strange	"It is not that bad people, ""Doctor Strange"" is not the greatest MCU movie of all time but it is still not that bad either. It is good, solid, decent sci-fi fantasy world about sources and mystical arts. I like the movie, it is good. This movie is in Phase Three in MCU movies and most of those movies suck now days. Sorry fans it is true I only like Captain America: Civil War and Spider-Man: Homecoming the rest of the movies I hate. Doctor Strange is a solid decent MARVEL origin superhero movie. Directed was by Scott Derrickson whoI was lucky enough to be among the press-junket last Wednesday to witness this movie! I usually rate movies by different aspects, but i'll also answer some questions my friends had about this film which I also had myself!Acting (10/10): This cast is amazing! They embody their characters instead of trying to act like the character. Benedict as Dr. Strange was a portrayal right out of the comics! Tilda as the ancient one killed it!Action (10/10): Wow! I could argue the action in this movie being on par with the scenes in civil war. It was so incredible watching thisWithout giving away too much, Benedict Cumberbatch just kills it. He is one class actor. Cumberbatch rocks as Strange and pulls it off with ease. The impressions his portrayal gives us is that he was born to play the role of the ex-neurosurgeon turned Sorcerer Supreme. Such is the talent of the lead cast, that it represents just how good the movie was overall. Every normal movie watcher will love the action, humour, adventure and fantasy throughout the film.A solid new character introduced to the Marvel Cinematic Universe with loads of potential. Cumberbatch solidifies and anchors his role in theWay back when I first heard that Doctor Strange was being brought to the screen I was a bit worried. How could they translate the complexity of character and his true coolness but stay away from the cheeseball stuff? Dress a guy up like the books and remain true to the seriousness of the character? Well, they managed to not only pull it off but deliver one of the best hero origin films ever made.The director knew that you had to establish and truly care about the character. Making it grounded but still trippy really helps give it a flavorDoctor Strange follows a surgeon who, after suffering from a major injury, sets out to search for healing. Instead, he ends up learning about magic. The movie opens with a scene that is both darker and funnier than most Marvel superhero movies I've seen. It sets the tone really well, and it actually manages to carry that all the way through. It is comedic, yet it maintains a level of urgency or threat to the entire situation that the characters constantly find themselves in, keeping the audience intrigued for most the entire duration. The special effects were probably the biggest"	7.5	0
Batman v Superman: Dawn of Justice	"*I will be talking about the Ultimate Edition of the film* This was one of the most anticipated CBM of all time. Ever since the arrival and subsequent success of Marvel's The Avengers people have wondered when will DC launch its own cinematic universe, one of the main reasons being the opportunity to finally see titans such as Batman and Superman share the screen together: the ultimate nerd dream. On 2016, the moment finally came for BvS to be released AND.. it performed poorly. Not only did critical reception left a lot to be desired, but fan reactions where surprisinglyWell, the wait is finally over. Batman and Superman are in a big screen film together for the first time in history. The result? A sloppy attempt at setting up the DC Universe. Batman v Superman has its moments though with great performances from almost every one and action that could rival Man of Steel, but it was difficult to not walk out of this film and feel overwhelmingly disappointed. For a film that finished filming over a year ago, you would think Zack Snyder and Warner Bros would make all the effort in the world to edit in andSadly, a step down from Man of Steel. First of all, I was a bit skeptical about this movie, and thought the runtime (about 2 and a half hours) was way too long (and I wasn't completely wrong though). The action scenes were better than what we saw in the trailer. Although the doomsday scenes had terrible CGI (you'll know it when you'll see it), but overall I was happy. The movie had a lot crazy-packed action (it was directed by Zack Snyder, what do ya expect?) but the plot didn't know where it was going. A lot of scenesI didn't see the film in the theaters and just bought the ""Extended Edition "" on Amazon. I never properly saw Man of Steel- i think I rented it and watched it when already exhausted and fell asleep. I saw the mediocre user reviews and horrible reviews from critics of this film.They really have it wrong. This is the very best either Batman or Superman. It has a different take, on things. Much darker then earlier films even darker then the Christopher Nolan Batman films.First of all Christopher Nolan is an Executive Producer. So how bad could it be? ILet's be honest! We were all, even marvel fan boys, waiting for this movie. The two most well known superheroes fighting... what could go wrong!? A lot. The positives:1. Batman & Alfred; Batfleck was amazing! Ben Affleck represented a batman that is damaged, changed his moral code(which if they play their cards right could be a center piece of solo batman films) and made him more bad-ass because of it. 2. The action: Amazing Action! It's thrilling, exciting and beautifully shot. That is what Zack does though and I expected nothing less. 3. Wonder woman: Supringsly well done. Her as"	6.5	0
Mandy	"This really is not for everyone and that is just fine. Also story wasnt anything new or special, just typical revenge story. Really liked howIm not going to bother writing a actual review of this really great breathe of fresh air film.  Plenty of others have done that on here it appears. They've been Pointing out that the film is a simple but very well done genre grindhouse film that throws back to films no one makes anymore, but with modern cinematic techniques.  This is just a reply to the people who seems to have no attention span, no imagination, need to be feed useless dialog, have no appreciation for imagery and cant pay attention unless theres tons of plot to sinkMandy is one hell of a piece of exquisite filmmaking. Combining arthouse with grindhouse has never come together quite as flawlessly as it does in this film. I couldn't help but immediately think Tarantino upon seeing the opening credits and as it progresses, the parallels are definitely there. That's not to say that this is a knockoff, quite the contrary, I think most filmmakers take cues from others and if Tarantino's work is one of Panos Cosmatos' inspirations, I welcome it. Also thrown in are some Charles Manson vibes, a subtle sense of humor, a killer, rock 'n' roll soundtrackMandy is the latest indie darling/art-house horror/Nic Cage film that is setting the internet ablaze and movie critics reaching for the hyperbolic adjectives. It's almost the perfect film for the current generation of movie goers: it's arty enough for the critics, hip enough for the nonchalant, above-everything crowd, gory and violent enough for the hardcore genre fans and it stars Nic Cage so even the ""oh my god he's just so crazy"", ""so-bad-it's-good"" meme makers are happy. Mandy tells the story of loving couple Red Miller and Mandy Bloom. Living in the Pacific north west in 1983, Red (Cage) worksNic Cage acted damn well n the film is good too. It is slow paced but there is something hypnotic about it. U don't get bore. There is a surrealistic feel to it. The colour palette"	6.7	0
Fantastic Beasts and Where to Find Them	"I really want to draw attention to the title of the review above. I'm sure many die-hard potterheads would want every review on this site to score this movie 10/10 and say it is a masterpiece. Well I can't do that, since that isn't my honest opinion. What I can say though is that Fantastic Beasts and Where to Find Them is a thoroughly entertaining affair that is well worth a watch, especially if you're a fan of J.K. Rowling's magical world. For starters the cast was great. Eddie Redmayne feels perfectly cast in main role as Newt Scamander. AI admit walking into the theater, I was very excited but also a little apprehensive. I should not have worried at all though, Fantastic Beasts and Where to Find Them was incredibly enjoyable! Rowling's magical world is as alluring and fun as ever! For me, the best thing about this movie is exactly that. Exploring this world.In the Harry Potter saga, with the exception of Deathly Hallows, most of the action was confined in Hogwarts. When we were taken out of the school, the main characters, being underage, were not allowed to do magic. The novelty in this movie isIt is unbelievable that JK Rowling's name is even attached to this film.The discipline and thought that went into the Harry Potter characters and story certainly wasn't applied to this catastrophe, which, like the Hobbit and so many other Hollywood regurgitation(s), merely seeks massive profits by piggybacking on a successful franchise while being utterly devoid of substance.It isn't even worth going into detail. There is only one truly likable character, though you can't relate to ANY character as we know absolutely nothing about them, nor do they have any developed relationships with each other. The entire script is built aroundAlthough I was a fan of the Harry Potter series, I had no preconceived notions or requirements for this stand-alone movie, other than an expectation that J.K. Rowling would not disappoint.Nonetheless, I was disappointed. The first half of the movie is basically an overlong visit to a CGI-created zoo. We watch as the protagonist hunts down a half dozen or so ""fantastic beasts"", mostly one at a time and in extended chase sequences. If you do not enjoy visiting zoos or watching car chases (which have the same dynamic as animal chases, no matter how exotic the species), you mayIt's OK, I suppose.Good parts: Period costumes & sets were beautiful. Special effects were (mostly) very good, and the Fantastic Beasts were individually great fun.So-so parts: The acting was only OK. Newt (Eddie Redmayne) in particular left me dissatisfied. Yes he's playing an introverted character, but I saw no reason for the bond he seemed to build with Tina. The MACUSA wizards & witches were extremely underdeveloped, including the President. Their hot-and-cold treatment of Tina for her interruptions made no sense to me either.Poor: The editing seemed off to me, in a way I haven't noticed since The Chamber of"	7.3	0
